{
  "schema_version": "3.0.0",
  "package_id": "pkg_bridge_int_test_01",
  "snapshot_id": "rel_bridge_ea6f1c4b",
  "created_at": "2026-10-23T13:06:08.778260+00:00",
  "rights_review_state": "ALLOWED",
  "source_ids": [
    "who_standard_2008"
  ],
  "members": [
    {
      "relative_path": "points/gb21.json",
      "sha256": "bd569204161b70ad71d0bd35e73445b588d9e44e95ac020c60c9e9cf926b57df",
      "rights_status": "ALLOWED"
    }
  ],
  "manifest_sha256": "f37ae6bddffec6af5a743dcc5ff90191a4808eaa8936a18a0f44ea0f0323d2d5",
  "signature": "LOCAL_RESEARCH_AUTHORITY_ED25519_SIG:f37ae6bddffec6af"
}